{
  "meta_review_date": "2026-06-04",
  "cycles_covered": [41, 42, 43, 44, 45, 46, 47, 48, 49, 50],
  "categorized_issues": {
    "low": [
      "Typo in book/src/spec/index.md (rendered as 'slcie')",
      "Inconsistent capitalization of 'L4' vs 'l4' across two slice files"
    ],
    "medium": [
      "Explorer prompt is silent on MFEM Vector mutation conventions; three cycles produced wrong mutation_pattern as a result",
      "find-tests-for-region skill assumes one test file per source area; gmres has tests split across test-iterative.cpp and test-orthog.cpp",
      "axpy concept signature uses positional arguments — three rotation claims used different argument orders; needs named axes per bunsen convention"
    ],
    "high": []
  },
  "direct_actions": [
    {
      "issue": "Typo 'slcie' in spec/index.md",
      "file": "book/src/spec/index.md",
      "change_summary": "Replace 'slcie' with 'slice' on line 23."
    },
    {
      "issue": "Inconsistent L4 capitalization",
      "file": "book/src/spec/slices/eigensolver_lobpcg.md",
      "change_summary": "Capitalize 'l4' to 'L4' in three section headings."
    }
  ],
  "plan_items": [
    {
      "issue": "Explorer prompt doesn't address MFEM Vector mutation conventions",
      "proposed_change": {
        "file": "prompts/explorer.md",
        "edit_description": "Add a paragraph after the mutation_pattern enumeration: 'MFEM Vector ops (Add, AddSubVector, *=, etc.) are accumulate-or-scale, not pure. Default to mutation_pattern=accumulator unless the source pattern clearly shows overwrite.'"
      },
      "cascade_trace": [
        "Three cycles produced wrong mutation_pattern on MFEM Vector ops.",
        "Critic flagged each independently; lesson.md gained the pattern after cycle 44.",
        "Resolution requires changing the Explorer prompt — Medium cascade."
      ],
      "risk_notes": "Low risk; additive to the prompt; no schema impact.",
      "depends_on": []
    },
    {
      "issue": "find-tests-for-region assumes one test file per source area",
      "proposed_change": {
        "file": "skills/find-tests-for-region/SKILL.md",
        "edit_description": "Step 3 'Verify the linkage' should explicitly handle the multi-file case: list ALL test files exercising the source, not just the topic-named one. Update the example."
      },
      "cascade_trace": [
        "gmres exploration cycle 47 missed test-orthog.cpp coverage of Arnoldi orthogonalization.",
        "Skill body says 'topic-keyed' suggesting one file; multi-file is silent.",
        "Skill refinement is Medium cascade per skills/README.md."
      ],
      "risk_notes": "Low risk; clarifying refinement to a skill.",
      "depends_on": []
    }
  ],
  "escalations": []
}
